<?xml version="1.0" encoding="UTF-8" standalone="no"?><vendeglatas xmlns:xsi="http://www.w3.org/2001/XMLSchema-instance" xsi:noNamespaceSchemaLocation="IOMAG5_XMLSchema.xsd">
        <etterem eKod="e1">
            <nev>Trófea</nev>
            <cim>
                <varos>Budapest</varos>
                <utca>Alma</utca>
                <hazszam>1</hazszam>
            </cim>
            <csillag>3</csillag>
        </etterem>

        <etterem eKod="e2">
            <nev>Leveses</nev>
            <cim>
                <varos>Miskolc</varos>
                <utca>Alma</utca>
                <hazszam>1</hazszam>
            </cim>
            <csillag>5</csillag>
        </etterem>

        <foszakacs e_f="e1" fKod="f1">
            <nev>Teszt Elek</nev>
            <eletkor>67</eletkor>
            <vegzettseg>8 általános</vegzettseg>
            <vegzettseg>gimnazium</vegzettseg>
        </foszakacs>

        <foszakacs e_f="e2" fKod="f2">
            <nev>Piros Alma</nev>
            <eletkor>31</eletkor>
            <vegzettseg>8 általános</vegzettseg>
            <vegzettseg>gimnazium</vegzettseg>
            <vegzettseg>Kulináris egyetem</vegzettseg>
        </foszakacs>

        <szakacs e_sz="e1" szKod="sz1">
            <nev>Kutya Kornél</nev>
            <reszleg>Konyha</reszleg>
            <vegzettseg>8 általános</vegzettseg>
        </szakacs>

        <szakacs e_sz="e1" szKod="sz2">
            <nev>Ötlet Elek</nev>
            <reszleg>Előkészületek</reszleg>
            <vegzettseg>8 általános</vegzettseg>
            <vegzettseg>gimnázium</vegzettseg>
        </szakacs>

        <szakacs e_sz="e2" szKod="sz3">
            <nev>Marha Marcell</nev>
            <reszleg>Előkészületek</reszleg>
            <vegzettseg>8 általános</vegzettseg>
            <vegzettseg>Orbán Viktor Szakközépiskola</vegzettseg>
            <vegzettseg>Egyetem</vegzettseg>
        </szakacs>

        <gyakornok e_gy="e1" gyKod="gy1">
            <nev>Disznó Dániel</nev>
            <gyakorlat>
                <kezdete>2025-06-01</kezdete>
                <idotartam>90</idotartam>
            </gyakorlat>
            <muszak>2025-06-01 délelőtt</muszak>
            <muszak>2025-06-03 délután</muszak>
        </gyakornok>

        <gyakornok e_gy="e3" gyKod="gy2">
            <nev>Hal Huba</nev>
            <gyakorlat>
                <kezdete>2025-08-01</kezdete>
                <idotartam>120</idotartam>
            </gyakorlat>
            <muszak>2025-08-01 délelőtt</muszak>
            <muszak>2025-08-03 délután</muszak>
        </gyakornok>

        <gyakornok e_gy="e2" gyKod="gy3">
            <nev>Csirke Csilla</nev>
            <gyakorlat>
                <kezdete>2026-01-01</kezdete>
                <idotartam>100</idotartam>
            </gyakorlat>
            <muszak>2026-01-01 délelőtt</muszak>
            <muszak>2026-01-02 délután</muszak>
        </gyakornok>

        <vendeg vKod="v1">
            <nev>Alma Palma</nev>
            <eletkor>25</eletkor>
            <cim>
                <varos>Eger</varos>
                <utca>Alma</utca>
                <hazszam>1</hazszam>
            </cim>
        </vendeg>

        <vendeg vKod="v2">
            <nev>Eszek Eszter</nev>
            <eletkor>19</eletkor>
            <cim>
                <varos>Győr</varos>
                <utca>Alma</utca>
                <hazszam>1</hazszam>
            </cim>
        </vendeg>

        

        

        

        

    </vendeglatas>